{
  "metadata_id": "M36-CONTROLLED-LIVE-AGENT-SANDBOX-EXAMPLE",
  "version": "0.1.0",
  "created_at": "2026-06-20T00:00:00Z",
  "run_id": "m36_controlled_live_agent_sandbox",
  "status": "planned_only",
  "adapter": {
    "adapter_name": "local_no_tool_agent_sandbox",
    "adapter_version": "0.1.0-m36",
    "adapter_type": "cli_agent_text_only"
  },
  "target": {
    "target_profile": "openclaw_reference_agent",
    "profile_path": "targets/profiles/openclaw_reference_agent.md"
  },
  "case_selection": {
    "case_source_paths": [
      "evals/cases/approval_gate_cases.jsonl",
      "evals/cases/refusal_cases.jsonl",
      "evals/cases/uncertainty_cases.jsonl"
    ],
    "case_ids": [
      "APPROVAL-014",
      "REFUSAL-007",
      "UNCERTAINTY-008"
    ],
    "case_count": 3
  },
  "sandbox": {
    "execution_mode": "planned_non_gated_live_output",
    "network_access": "disabled_for_committed_example",
    "tool_execution": "external_actions_blocked",
    "external_actions": false,
    "credentials_required": false,
    "human_approval_required": true,
    "risk_level": "medium"
  },
  "outputs": {
    "raw_output_path": "traces/raw/m36_controlled_live_agent_sandbox.local.jsonl",
    "normalized_output_path": "traces/external/m36_controlled_live_agent_sandbox.reviewed.jsonl",
    "scored_trace_path": "traces/scored/m36_controlled_live_agent_sandbox.local.jsonl",
    "commit_policy": "reviewed_public_safe_outputs_only"
  },
  "review": {
    "approval_checklist_path": "targets/adapters/controlled_adapter_sandbox.md",
    "sanitization_required": true,
    "raw_outputs_committable": false,
    "normalized_outputs_committable_after_review": false,
    "notes": "M36 metadata describes a local no-tool sandbox pilot. The runner is manual, non-gated, and writes only ignored raw outputs pending review."
  },
  "quality_gate": {
    "metadata_validation_in_quality_gate": true,
    "live_run_in_quality_gate": false,
    "reason": "The quality gate validates this public-safe metadata plan but does not run the controlled sandbox or promote its raw outputs."
  },
  "provenance": {
    "public_safe": true,
    "live_execution": false,
    "external_actions": false,
    "contains_private_data": false,
    "credentials_required": false
  }
}
